<?xml version="1.0" encoding="UTF-8"?>
<!-- 
OMA DM DevInfo V1.2 DDF.
Copyright Open Mobile Alliance Ltd., 2005-2007. All rights reserved
This DDF contains a description of the DM information management object (DevInfo), according to the OMA DM Description Framework.
-->

<!-- <!DOCTYPE MgmtTree PUBLIC "-//OMA//DTD-DM-DDF 1.2//EN"
             "http://www.openmobilealliance.org/tech/DTD/DM_DDF-V1_2.dtd"
             [<?oma-dm-ddf-ver supported-versions="1.2"?>]> -->

<!-- 
FILE INFORMATION
OMA Permanent Document
   File: OMA-SUP-MO_dm_devinfo-V1_2-20070209-A
   Type: Text
Public Reachable Information
   Path: http://www.openmobilealliance.org/tech/omna/dm_mo
   Name: dm_devinfo-v1_2.ddf
NORMATIVE INFORMATION
This DDF contains a description of the DM information management object (DevInfo), according to the OMA DM Description Framework.
Information about this Management Object is available in the Specification
           OMA-TS-DM_StdObj-V1_2-20070209-A
Send comments to technical-comments@mail.openmobilealliance.org

LEGAL DISCLAIMER

Use of this document is subject to all of the terms and conditions
of the Use Agreement located at
	http://www.openmobilealliance.org/UseAgreement.html

You may use this document or any part of the document for internal
or educational purposes only, provided you do not modify, edit or
take out of context the information in this document in any manner.
Information contained in this document may be used, at your sole
risk, for any purposes.

You may not use this document in any other manner without the prior
written permission of the Open Mobile Alliance.  The Open Mobile
Alliance authorizes you to copy this document, provided that you
retain all copyright and other proprietary notices contained in the
original materials on any copies of the materials and that you
comply strictly with these terms.  This copyright permission does
not constitute an endorsement of the products or services.  The
Open Mobile Alliance assumes no responsibility for errors or
omissions in this document.

Each Open Mobile Alliance member has agreed to use reasonable
endeavors to inform the Open Mobile Alliance in a timely manner of
Essential IPR as it becomes aware that the Essential IPR is related
to the prepared or published specification.  However, the members
do not have an obligation to conduct IPR searches.  The declared
Essential IPR is publicly available to members and non-members of
the Open Mobile Alliance and may be found on the 'OMA IPR
Declarations' list at http://www.openmobilealliance.org/ipr.html.
The Open Mobile Alliance has not conducted an independent IPR review
of this document and the information contained herein, and makes no
representations or warranties regarding third party IPR, including
without limitation patents, copyrights or trade secret rights.  This
document may contain inventions for which you must obtain licenses
from third parties before making, using or selling the inventions.
Defined terms above are set forth in the schedule to the Open Mobile
Alliance Application Form.

NO REPRESENTATIONS OR WARRANTIES (WHETHER EXPRESS OR IMPLIED) ARE
MADE BY THE OPEN MOBILE ALLIANCE OR ANY OPEN MOBILE ALLIANCE MEMBER
OR ITS AFFILIATES REGARDING ANY OF THE IPR'S REPRESENTED ON THE 'OMA
IPR DECLARATIONS' LIST, INCLUDING, BUT NOT LIMITED TO THE ACCURACY,
COMPLETENESS, VALIDITY OR RELEVANCE OF THE INFORMATION OR WHETHER OR
NOT SUCH RIGHTS ARE ESSENTIAL OR NON-ESSENTIAL.

THE OPEN MOBILE ALLIANCE IS NOT LIABLE FOR AND HEREBY DISCLAIMS ANY
DIRECT, INDIRECT, PUNITIVE, SPECIAL, INCIDENTAL, CONSEQUENTIAL, OR
EXEMPLARY DAMAGES ARISING OUT OF OR IN CONNECTION WITH THE USE OF
DOCUMENTS AND THE INFORMATION CONTAINED IN THE DOCUMENTS.

(c) 2007 Open Mobile Alliance Ltd.  All Rights Reserved.
Used with the permission of the Open Mobile Alliance Ltd. under the
terms set forth above.
-->

<MgmtTree>
	<VerDTD>1.2</VerDTD>
	<Node>
		<NodeName>DevCommand</NodeName>
		<!--The '.' shows that this node is located immediately under the root.-->
		<Path>.</Path>
		<DFProperties>
			<AccessType>
				<Get/>
			</AccessType>
			<DFFormat>
				<node/>
			</DFFormat>
			<Scope>
				<Permanent/>
			</Scope>
			<DFTitle>The interior node holding all devcommand objects</DFTitle>
			<DFType>
				<DDFName></DDFName>
			</DFType>
		</DFProperties>
		<Node>
			<NodeName>Ring</NodeName>
			<!--There are no further items here at the moment.-->
			<DFProperties>
				<AccessType>
					<Exec/>
				</AccessType>
				<DFFormat>
					<node/>
				</DFFormat>
				<Scope>
					<Permanent/>
				</Scope>
				<DFTitle>Ring operation</DFTitle>
				<DFType>
					<DDFName></DDFName>
				</DFType>
			</DFProperties>
		</Node>
		<Node>
			<NodeName>Lock</NodeName>
			<DFProperties>
				<AccessType>
					<Exec/>
				</AccessType>
				<DFFormat>
					<node/>
				</DFFormat>
				<Scope>
					<Permanent/>
				</Scope>
				<DFTitle>Lock operation</DFTitle>
				<DFType>
					<DDFName></DDFName>
				</DFType>
			</DFProperties>
            <Node>
                <NodeName>Reset</NodeName>
                <DFProperties>
                    <AccessType>
                        <Exec/>
                    </AccessType>
                    <DFFormat>
                        <node/>
                    </DFFormat>
                    <Scope>
                        <Permanent/>
                    </Scope>
                    <DFTitle>Reset lock operation</DFTitle>
                    <DFType>
                        <DDFName></DDFName>
                    </DFType>
                </DFProperties>
            </Node>
        </Node>
        <Node>
            <NodeName>Wipe</NodeName>
            <DFProperties>
                <AccessType>
                    <Exec/>
                </AccessType>
                <DFFormat>
                    <node/>
                </DFFormat>
                <Scope>
                    <Permanent/>
                </Scope>
                <DFTitle>Wipe operation</DFTitle>
                <DFType>
                    <DDFName></DDFName>
                </DFType>
            </DFProperties>
        </Node>
        <Node>
            <NodeName>Mute</NodeName>
            <DFProperties>
                <AccessType>
                    <Exec/>
                </AccessType>
                <DFFormat>
                    <node/>
                </DFFormat>
                <Scope>
                    <Permanent/>
                </Scope>
                <DFTitle>Mute operation</DFTitle>
                <DFType>
                    <DDFName></DDFName>
                </DFType>
            </DFProperties>
        </Node>
    </Node>
</MgmtTree>


